{
  "$schema": "https://json-schema.org/draft/2020-12/schema",
  "$id": "urn:agent-credentials:credential-context:schema:0.3.0",
  "title": "Credential Context",
  "contractVersion": "0.3.0",
  "description": "Provider-neutral, runtime-neutral credential context contract of the Agent Credential Layer v0.3. A credential context identifies which credential reference is selected for an operation, by reference and never by value. It is a separate contract layer from the v0.2 Diagnosis Result and never carries secret material. Forbidden property names: token, password, secret, apiKey, credentialValue, authorizationHeader, rawCredential.",
  "type": "object",
  "required": [
    "contractVersion",
    "provider",
    "operation",
    "executionContext",
    "availableReferences"
  ],
  "additionalProperties": false,
  "propertyNames": {
    "not": {
      "enum": [
        "token",
        "password",
        "secret",
        "apiKey",
        "credentialValue",
        "authorizationHeader",
        "rawCredential"
      ]
    }
  },
  "properties": {
    "contractVersion": {
      "const": "0.3.0",
      "description": "Public contract version of the credential-context layer."
    },
    "provider": {
      "type": "string",
      "minLength": 1,
      "description": "Provider identifier handled by an adapter. The schema itself depends on no specific provider (for example example-provider or any adapter-defined namespace)."
    },
    "operation": {
      "type": "string",
      "minLength": 1,
      "description": "Operation the context is selected for (for example push, api, release, publish, auth-check)."
    },
    "executionContext": {
      "type": "object",
      "required": ["runtime"],
      "additionalProperties": false,
      "description": "Safe execution-context facts reused from the v0.2 diagnosis layer. Unknown values are expressed as null; nothing here is forced.",
      "properties": {
        "runtime": {
          "enum": ["host", "sandbox", "container", "remote", "ci", "unknown"],
          "description": "Kind of execution context, if known; unknown is always permitted."
        },
        "runtimeIdentifier": {
          "type": ["string", "null"],
          "description": "Optional identifier of the runtime/checkout, never a secret."
        },
        "keyringAccessible": {
          "type": ["boolean", "null"],
          "description": "Whether the OS keyring is accessible from this context, if known."
        },
        "envPropagated": {
          "type": ["boolean", "null"],
          "description": "Whether environment variables are propagated into this context, if known."
        },
        "networkReachable": {
          "type": ["boolean", "null"],
          "description": "Whether the target network is reachable, if known."
        },
        "toolAvailable": {
          "type": ["boolean", "null"],
          "description": "Whether the provider CLI/tool is available, if known."
        }
      }
    },
    "requestedProfile": {
      "type": ["string", "null"],
      "description": "Profile requested by the caller or project binding, if any."
    },
    "selectedProfile": {
      "type": ["string", "null"],
      "description": "Profile selected by the resolver, if any."
    },
    "expectedAccount": {
      "type": ["string", "null"],
      "description": "Account the operation expects, if known."
    },
    "expectedHost": {
      "type": ["string", "null"],
      "description": "Host the operation expects, if known."
    },
    "availableReferences": {
      "type": "array",
      "items": {
        "$ref": "#/$defs/CredentialReference"
      },
      "description": "Credential references available for selection, by reference only."
    },
    "selectedReference": {
      "anyOf": [
        {
          "$ref": "#/$defs/CredentialReference"
        },
        {
          "type": "null"
        }
      ],
      "description": "The chosen credential reference, or null when none could be selected (for example ambiguity)."
    },
    "ambiguity": {
      "type": "boolean",
      "description": "True when resolution could not deterministically select and failed closed."
    },
    "metadata": {
      "type": "object",
      "additionalProperties": true,
      "propertyNames": {
        "not": {
          "enum": [
            "token",
            "password",
            "secret",
            "apiKey",
            "credentialValue",
            "authorizationHeader",
            "rawCredential"
          ]
        }
      },
      "description": "Safe, non-secret extension metadata. Must never carry secret material."
    }
  },
  "$defs": {
    "CredentialReference": {
      "type": "object",
      "required": ["provider", "sourceType", "reference"],
      "additionalProperties": false,
      "propertyNames": {
        "not": {
          "enum": [
            "token",
            "password",
            "secret",
            "apiKey",
            "credentialValue",
            "authorizationHeader",
            "rawCredential"
          ]
        }
      },
      "description": "A reference to one credential, never the credential value itself.",
      "properties": {
        "provider": {
          "type": "string",
          "minLength": 1
        },
        "sourceType": {
          "enum": ["env", "file", "keyring", "connector", "cli", "broker", "profile", "other"],
          "description": "Where the credential value lives. The reference itself is still only a logical reference."
        },
        "reference": {
          "type": "string",
          "minLength": 1,
          "pattern": "^[A-Za-z0-9._:/+-]+$",
          "description": "Safe logical reference, for example env/GH_TOKEN, connector/default, profile/personal, broker/github/work. Never a secret value."
        },
        "account": {
          "type": ["string", "null"],
          "description": "Account that owns the credential, if known."
        },
        "profile": {
          "type": ["string", "null"],
          "description": "Logical profile this reference belongs to, if any."
        },
        "host": {
          "type": ["string", "null"],
          "description": "Target endpoint/host, if known."
        },
        "metadata": {
          "type": "object",
          "additionalProperties": true,
          "propertyNames": {
            "not": {
              "enum": [
                "token",
                "password",
                "secret",
                "apiKey",
                "credentialValue",
                "authorizationHeader",
                "rawCredential"
              ]
            }
          },
          "description": "Safe, non-secret extension metadata. Must never carry secret material."
        }
      }
    },
    "CredentialProfile": {
      "type": "object",
      "required": ["name", "provider", "references"],
      "additionalProperties": false,
      "propertyNames": {
        "not": {
          "enum": [
            "token",
            "password",
            "secret",
            "apiKey",
            "credentialValue",
            "authorizationHeader",
            "rawCredential"
          ]
        }
      },
      "description": "A stable logical profile. A profile selects references; it contains no secrets.",
      "properties": {
        "name": {
          "type": "string",
          "minLength": 1,
          "description": "Stable logical profile name, for example personal or work."
        },
        "provider": {
          "type": "string",
          "minLength": 1
        },
        "references": {
          "type": "array",
          "items": {
            "type": "string",
            "minLength": 1,
            "pattern": "^[A-Za-z0-9._:/+-]+$"
          },
          "description": "Ordered reference ids this profile selects, by reference only."
        },
        "expectedAccount": {
          "type": ["string", "null"],
          "description": "Account this profile expects, if known."
        },
        "expectedHost": {
          "type": ["string", "null"],
          "description": "Host this profile expects, if known."
        },
        "metadata": {
          "type": "object",
          "additionalProperties": true,
          "propertyNames": {
            "not": {
              "enum": [
                "token",
                "password",
                "secret",
                "apiKey",
                "credentialValue",
                "authorizationHeader",
                "rawCredential"
              ]
            }
          },
          "description": "Safe, non-secret extension metadata. Must never carry secret material."
        }
      }
    }
  }
}
